{
	"id": "operate-patch-existing-001",
	"kind": "operate",
	"profile": "large",
	"promptTemplate": [
		"You are in the repository root for this benchmark.",
		"Use the Obsidian CLI that is already available in this repo for vault inspection and vault writes. Prefer `./bin/obsidian-dev obsidian ...` commands when you need vault data or file edits.",
		"Return only JSON matching the provided schema. Do not wrap the JSON in markdown fences.",
		"Do not edit `.obsidian/` or `{{golden.paths.restrictedPrefix}}`.",
		"Task: append the exact checklist line `{{golden.patchExisting.appendedLine}}` to the markdown note at `{{golden.patchExisting.path}}`. Do not modify any other file. Return the edited path."
	],
	"timeoutMs": 180000,
	"maxTurnsHint": 12,
	"expectedAnswer": {
		"path": "{{golden.patchExisting.path}}"
	},
	"expectedDiff": [
		{
			"path": "{{golden.patchExisting.path}}",
			"mustExist": true,
			"contains": "{{golden.patchExisting.appendedLine}}"
		}
	],
	"forbiddenPaths": [".obsidian/", "{{golden.paths.restrictedPrefix}}"],
	"requiredCommands": ["./bin/obsidian-dev obsidian excli-apply-patch"],
	"tags": ["operate", "patch", "synthetic"]
}
